id,sent0,label
5359,Reminder: @JoeBiden cast one of the key votes to help Republicans narrowly defeat legislation by @BernieSanders and Paul Wellstone designed to stop pharmaceutical price gouging. Pass it on,1
2134,"I've heard they wanna export it to uncle Charlie over in China, because the chinks are paying top dollar for it! https://t.co/lqSnjg0mei",2
2456,@RahulGandhi It has been confirmed in Thailand as well.. ladyboys se bach ke rehna pappu.. varna tu corona ko apne saath India aur Italy le jaayega.,1
5048,Picture of people lying on the street is being shared online with a caption that implies that the picture is related to the recent outbreak of coronavirus in China,0
2875,Chloroquine can 100% cure COVID-19,0
1953,"@Paul42980402 ""Coronavirus could shut down parliament for months under emergency plans"" Given the Tories large Commons majority, will it make much difference",1
2078,"“We have enough stock within Singapore so there should not be a situation where we anticipate the masks running out at any time,” MOH said” https://t.co/omoZsqjfxS",2
5173,Ministry of health’s emergency notification to the public about coronavirus outbreak,0
6621,China has never opened its own market to competition from @ericsson @nokia in terms of 5G prime contractor status. Nor has China provided clear explanations as to the level of state support for @H… https://buff.ly/2tIfFwM,0
641,FISA court delays deadline for DOJ's proposed reforms amid coronavirus,1
4059,Claim that football star Cristiano Ronaldo has converted his hotel chain into coronavirus hospitals,0
5904,"The Huanan seafood market in Wuhan has been widely considered the source of the outbreak of a novel coronavirus. But the virus may have infected people elsewhere first, a new paper suggests",2
5191,Chinese panic video over Corona Virus,0
6047,"BREAKING: India's first case of novel coronavirus confirmed. Student from Kerala who had returned from Wuhan. Being kept in isolation, stable, being monitored",2
2601,"#coronavirus Italy was the first country to deny Chinese citizen entry to EU, now they have the first deaths. #InstantKarma",1
2369,@gerpaq44 @Destinbeach22 Separated room and bathroom ventilation key if a member in household is sick. Why did China make everyone wear masks! if you’re in an area where you’re in close quarters the risk is high if your near someone infected,1
521,Homeopathic supplements have proven to treat the flu,0
4839,Photos of a Chinese man eating “human baby soup” that circulated on social networking platforms. He is seen sitting at a table with a stillborn baby served in front of him,0
6165,"China will offer more credit support to key companies in epidemic control to combat the novel coronavirus outbreak, the Ministry of Finance said Sunday",2
3986,MOSTLY Says it was “unquestionably” not within his “legal authority” to postpone Illinois’ primary election by changing the date or shifting to vote-by-mail,1
3528,New York hospitals treating coronavirus patients with vitamin C,0
1284,Indian industry may get to fill gap left by Chinese traders,2
1696,Harvard professor Charles Lieber was arrested for concealing funding from a Chinese lab connected to the origin of the new coronavirus,0
144,Drinking vodka can bfight the coronavirus,0
578,US Navy ship headed to Los Angeles for coronavirus relief: Here's a look inside,1
5858,"Coronavirus outbreak: State Department races to get Americans out of Wuhan, China",2
6629,#PutinsPuppet Five Evacuated Americans Are Being Tested for Coronavirus in California: Five Americans quarantined at an Air Force… https://twitter.com/i/web/status/1226776839978250241 …,0
6389,"With the CDC confirming the first case of the Wuhan coronavirus here in the United States in Seattle, Washington, there are definitely more cases than have been estimated. The virus has an incubation time of 8-10 days so people probably traveled internationally without symptoms",0
3277,"In a seemingly careless message being sent as an e-mail, recipients in Greek are warned that if a company (shop) has to shut down because of the new coronavirus or staff illness or other reason, the sender must notify the sender of that message about the termination of the employment of an employee",0
2990,"""COVID-19 started because we eat animals.""",0
2805,nytimes Pence Will Control All Coronavirus Messaging From Health Officials. Poor tRumpsters ....they are gonna suffer,2
5460,There are now more than 500 cases of novel coronavirus in the US https://www.cnn.com/asia/live-news/coronavirus-outbreak-03-08-20-intl-hnk/h_9d766c83ab186b483ef14822ae09e763 … Stop promoting fear CNN. You guys are very misguided in your information,1
5788,"SCMP: Wuhan coronavirus: Cathay Pacific offers refunds on all mainland China flights until end of February, as Hong Kong’s tour agents cancel bookings",1
2648,Fears that coronavirus may turn into pandemic grip Washington - https://t.co/snkLyMuSby,2
4874,Chinese citizens join Muslim prayers because of fear of coronavirus,0
2939,Dolphins and swans return to Italy waterways after Covid-19 lockdown,0
4175,People panicking about a COVID-19 case at the Dakar Airport,0
6042,It looks like the virus attaches to a specific receptor in lung tissue ACE2 protein receptor. Men are more susceptible than women and Asian men are particularly at risk more so than African and European males,2
3476,Nostradamus predicted the coronavirus pandemic,0
2917,Breathing in hot air from a hair dryer or in a sauna can prevent or cure COVID-19,0
5331,"Single nurse, 30, asks China to 'assign' her a boyfriend as a reward for helping Wuhan fight killer coronavirus",1
4622,Misleading Chloroquine cures CoV,0
5031,Says “the coronavirus was engineered by scientists in a lab.”,0
6779,"It would be terrible if all the maggots listening to Trump Bullshit get the coronavirus and die. He is pushing them that way with his untrue, misguided, self serving half truths. I feel sorry for them",1
5110,The “proper” way of wearing a surgical mask is blue side out if you are sick and white side out if you do not want to be infected by the virus,0
1121,China sends planes to bring 'stranded' overseas residents back home to Wuhan,2
3294,"The Brazilian Government is handling a 600 brazilian reais monthly COVID-19 emergency allowance to poor citizens. To access it, you need to fill out an oficial form (link to the form)",0
4196,COVID-19 Breeds Rapidly In Toilet Paper,0
6705,"China reports that deaths from #coronavirus rise by 73 to 563, and the number of confirmed cases rise by 3,694 to 28,018. It’s hard to discern how much their reporting on new cases is still being skewed by their fixed and limited testing capacity",2
6595,Bull market is immune to Coronavirus,0
1008,Burger King responds to coronavirus pandemic by offering free kids meals,1
3664,The outbreak was discussed in the German Bundestag back to 2012,0
2590,"A Brisbane woman who had been working as an au pair in northern Italy is relieved she managed to flee the country before it became locked down, as coronavirus turned her trip of a lifetime into a nightmare. #7NEWS https://t.co/zc1oimUbQw",2
6204,"Coronavirus updated figures:- 362 deaths recorded - More than 17,000 people infected - More than $400 billion wiped off Chinese stock markets today - Virus in 24 countries already - China urgently seeks medical equipments/aids",2
1290,Coronavirus could be ‘death blow’ for many of China’s small manufacturers if not under control by April,2
6597,Ugandans in Wuhan aren’t asking for too much. Evacuate them and quarantine/monitor them once they land,0
1900,@CDCgov @DrNancyM_CDC Why? Stop the flights! Taking people's temperature @ the airport is useless. The risk is low...now. That will change if you keep letting people in from Wuhan. This is insanely reckless and grossly negligent. No quarantine either? #coronavirus #StopTheFlights https://t.co/P7wO5rB7jR,2
3425,Coronavirus is found in Broiler Chicken,0
572,A provision in the $2 trillion coronavirus response package that Republican senators had warned could fuel layoffs looks likely to remain in the text -- after an 11th-hour effort to remove it in the Senate was shot down,1
6497,"Confirmed, there are kits on the way to Wuhan. We dont have the real numbers because they are overwhelmed and cannot test everyone",0
1590,A Chinese intelligence officer has leaked details on how the coronavirus outbreak is supposedly caused by a bioweapon,0
2355,@TeamYouTube @Fight4HongKong Discussing #CoronavirusOutbreak becomes sensitive? Why pro-China channels spreading misinformation about the outbreak can be momentised? Can you explain why 🇭🇰🇹🇼 channels promoting democracy are demonetized without reasons? Is there political censorship from your team members,2
2667,Berlin wants to evacuate more Germans from virus-hit Wuhan: magazine https://t.co/PxijZR4oal,1
5878,"""The dean of the university's medical school, Gabriel Leung, said his team has estimated that as of Saturday, some 44,000 people in Wuhan alone were likely to have been infected by the new virus.""",2
4762,Having 14 face masks is enough. You can reuse them every 14 days since the incubation period is 14 days,0
1034,"The EU’s chief Brexit negotiator, Michel Barnier, tested positive. He is 69 years old and previously worked as France’s former foreign minister",1
613,"Dr. Anjali Bharati, an emergency medicine physician at Northwell Health in New York City, said on “Fox & Friends” on Thursday that the volume of emergency cases related to the novel coronavirus has “definitely gone down” this week, however, the severity of the symptoms has “really kicked up a notch.”",1
888,Maryland governor closes all non-essential businesses over coronavirus concerns,1
6944,CoVID-19 (coronavirus) **Please do not contact your GP practice for a rescue pack.** We've seen inaccurate information on social media regarding special 'rescue packs' This is not an appropriate treatment for most people with respiratory conditions,1
3456,COVID-19 patients will not show symptoms for the first 14 days,0
4183,Drinking hot beverages prevents coronavirus infection,0
7123,"Tom Hanks, 63, one of America's most iconic actors revealed that he tested positive for coronavirus while in Australia to film a movie. Since then, he's offered fans several updates on his condition, assuring fans that he's well taken care of and urging them to be diligent and proactive",1
3698,WhatsApp chain from workers of Argentina´s most important lab that is testing for coronavirus. They advised not to leave the house because the next 2 weeks were the infection peak,0
874,"Authorities in Spain will use an Olympic-sized ice rink as a makeshift morgue for victims of the coronavirus until funeral homes can take them, officials said",1
2279,195 Americans Are Released From Coronavirus Quarantine At California Air Base https://t.co/nFq1qZ2R5t https://t.co/4VMfvWEXQG,1
6251,"Please check on everyone. NO family is exempt from losing a family member, friend, neighbor or stranger. #Suicide has become an epidemic that can be helped IF we commit to being part of the solution, not part of the problem. Take it from a #Widow of Suicide, #loss is devastating",2
462,Daniel Radcliffe has the coronavirus,0
1573,A Muslim man spitting on cops during the COVID-19 outbreak,0
4198,A Twitter post claimed Christiano Ronaldo is transforming his string of hotels to hospitals; to aid in the fight against COVID-19,0
528,Muslims are proved not to get coronavirus,0
2572,#Coronavirus: Iran reports two suspected fatal cases at Qom hospital https://t.co/hilF0OhGKQ,1
5634,"Sorry for sounding skeptical but it's strange when Left/Dems seem to be losing there always seems to be some ""major crisis"" that emerges to distract. CDC is reporting the first case of Coronavirus from China has been confirmed in the US",1
134,US capitol closing to public until April amid coronavirus outbreak,1
4678,"In Poland, people who are not insured have to pay for medical test for coronavirus, so if they can’t afford it, they will spread it",0
2325,@RepAdamSchiff Trump is just a horrible human being. He is one of the worst human beings. Look at how he is lying about the coronavirus stuff,2
5678,"“ASD can sometimes be detected at 18 months or younger. By age 2, a diagnosis by an experienced professional can be considered very reliable.” - taken straight from the cdc’s website. Many children don’t get a final diagnosis until they are around 4 or 5",1
6803,Packages from China are dangerous,0
6134,Eating meat is a heinous sin. It increases the risk of cancer and other deadly diseases. Like the corona virus came from the meat market,2
3286,"Santiago Abascal, general secretary of VOX (political party), allegadly didn’t respect the quarantine period after being tested positive for COVID-19",0
3518,"“In Chicago, Covid-19 actually LOWERED the death rate.”",0
202,On fabric it can survive for 6-12 hours. normal laundry detergent will kill coronavirus,0
1748,Lemon and turmeric is an effective preventive measure against covid-19,0
5811,Trending on PubMed: Stop the Wuhan virus,2
4200,Staff of Gold Coast Hospital in Australia has gifted a volleyball to Tom Hanks in quarantine,0
6842,coronavirus is not new for scientists and not life threatening if precautionary measures be taken and immediate treatment is provided but once it's left untreated or poorly late diag,0
4340,The Italian Ministry of Interior ruled with a public statment that police will check all the people that will exit from their house,0
49,A Nostradamus prophecy foretells the 2020 COVID-19 coronavirus disease pandemic,0
295,Twitter will remove content that promotes unverified claims and misinformation about coronavirus,1
3373,Leader of North Korea Kim Jong-Un Visits an Infected Woman Without Wearing Mask,0
5689,"On #WuhanCoronavirus, as soon as the govt loosened info censorship, Chinese media such as Caixin & Beijing News新京报 have had the best coverage, way more in-depth and ahead of any int outlets. Imagine how vibrant the Chinese media scene would be if only there's no censorship",1
1586,"India will see a spike in Coronavirus cases after March 27, 2020",0
6854,Symptoms of new coronavirus include vomiting blood,0
2975,"""George Soros owns the WuXi PHARMA LAB located in Wuhan, China where COVID-19 was developed and conveniently Broke Out.""",0
3025,A viral screenshot of a story allegedly published by the BBC claiming Ghana has recorded its first confirmed coronavirus case,0
4345,COVID-19 medicine was found in Ghana,0
4891,Thai department of health published an infography on how to properly wear facemasks,0
5891,"This is a problem: “China’s top leader, Xi Jinping, has promised drastic measures to contain the virus.” Drastic measures can make things worse. We need smart measures",2
5085,The first building of the Huoshenshan hospital in Wuhan city was build in 5 days,0
963,"On March 9, Boston Mayor Marty Walsh cancelled the city’s St. Patrick’s Day Parade, which hosts anywhere from 600,000 to 1 million attendees every year, according to Trip Savvy",1
4433,Turks are not gonna be infected by COVID-19 due to their genes,0
39,"Congress has passed a US$8.3 billion coronavirus response bill, which includes $2.2 billion for the CDC to “prevent, prepare for, and respond to coronavirus, domestically or internationally.”",1
4410,A video purporting to show panic-stricken travellers infected with the novel coronavirus at an airport in Senegal has been shared hundreds of times on Facebook,0
5214,A video has gone viral on social media which claims to feature one of the victims of the deadly virus,0
3382,Brazillian President Declares “Gaza is the Only coronavirus Free City”,0
5592,"It's not like he called it the Ching Chong Prague, you drunken camel-faced spit machine",1
4479,Masks from Wet Wipes Effectively Prevents Corona Virus Transmission,0
6400,"Breaking News: An individual in Washington State is infected with the Wuhan coronavirus, the first such case in the U.S. The outbreak, which began at a market in China, has now spread to at least four other countries",0
7107,Phone calls recording and whatsup monitoring. It's a false news,1
4476,New coronavirus was registered in 2018,0
4310,Welfare ministry for the Region Lombardy has said that “China lied to us” and “all of the data provided by the Chinese government are fake”,0
6395,"My look at how #WuhanCoronavirus is impacting China’s steel sector, as millions of construction workers are set to go home",0
1399,A 101-year-old Italian man who tested positive for coronavirus has been released from hospital。,2
1692,"U.S. Sen. Lindsey Graham said, ""President Trump probably knows more about medicine and specifically viruses than any of the so-called scientists at the NIH and CDC.""",0
3181,Hindu God Ganesha’s idol placed and worshiped inside an Italian Church,0
3890,China has successfully tested an anti-coronavirus serum made in Egypt and presented in Beijing by the Egyptian Minister of Health,0
5545,This virus is on the campaign trail of a lifetime. Lowering airline and gas prices?Giving people paid leave from work? Making college campuses revert to online classes for a month? Corona is tryna secure your vote,1
1835,Corporation of Chennai has closed all vegetable and fruit markets in various parts of Chennai has been shared on WhatsApp and Facebook amid the coronavirus outbreak,0
4826,Vitamin C and Omega prevents coronavirus,0
217,The U.S. Centers for Disease Control and Prevention says hand sanitizers with 60% alcohol can be used to help prevent contracting and spreading the virus,1
6391,"Based on current information, the immediate health risk ... to the general American public is deemed to be low at this time. Nevertheless",0
1881,Washington State: CDC confirms first case of coronavirus in U.S. #NationalNews #WashingtonState #HealthWatch https://t.co/pLrzNiUIaH https://t.co/EpA8VBe6KQ,1
5019,Scientists from Australia create the first vaccine for novel coronavirus,0
4624,A case of coronavirus in the Argentine province of Santiago del Estero was confirmed,0
6586,LIAR CRIMINAL Criminals need to protect another. You've rubbed in our faces with your guilt,0
7178,"The number of new cases from China's coronavirus epidemic dropped for a third consecutive day, but global concern remains high about its spread",0
7164,Partly Turkey helped Italy with 200.000 masks and other equipment but nobody took notice,0
154,"I Heard That The U.S. Government Is Sending $1,000 Checks",0
4448,A confidential governmental document proves that the government has decided to postpone local elections in France because of the outbreak,0
2569,@TenebraeAeterna @thinklearnnow @jenniferatntd @realDonaldTrump It's not my government causes the virus. you are being taught that China caused the virus. it's a virus killing a lot of Chinese,2
5195,The Simpsons predicted the epidemic in advance,0
1555,"An anti-terror mock drill to the coronavirus conducted by the Bikapur Police in Ayodhya, Uttar Pradesh",0
1051,"A new study suggests that ending social distancing too soon in Wuhan, China, where the novel coronavirus outbreak started, could cause a ""second wave"" in the summer",2
4912,Chinese Premier Li Keqiang had dinner in Wuhan during the epidemic,0
3354,"Sisi Raised The Numbers of coronavirus Cases In Egypt, In The Hope of Billions From The World Bank",0
1829,"#Belgium prohibits sexual acts of more that 3 people after 500 person #orgy spread #coronavirus. However, #bestiality is still allowed.”",0
6524,"The main epidemic situation is only in Wuhan, which is under control",0
1143,"Google joins hands with WHO to contain coronavirus outbreak ""Coronavirus cases may be undercounted even with 3,000% surge""",2
834,"A Catholic priest in Italy is being called a ""Martyr of Charity"" for refusing a respirator so a younger patient could use it to ward off the coronavirus",1
456,"The Itali government’s extraordinary measures, announced at Palazzo Chigi late on 9 March, comes amid a worsening of the coronavirus outbreak. The new stringent measures, covering the entire country, and would take effect tomorrow morning",1
2678,China announces agreement with US to phase out additional tariffs https://t.co/MGs8odFtPB https://t.co/kC8okrlaCs,2
5731,"There are more first person accounts of Wuhan's gridlock here. Airports. Streets. Hospitals. Again, tens of millions are trapped within this, many unknowingly incubating. Their ability to freely roam is shrinking w/ every comment from Chinese authorities",1
147,Warm weather will kill coronavirus,2
2122,"I hope coronavirus screening was put in place for attendees at the #NigeriaPetroleumSummit We can't compound our problems by infecting the top players in the oil industry, or...nvm",2
4312,Purported government advisory claiming to list shopping malls and hotels in the Phillippines that the department of health advises against visiting during the novel coronavirus epidemic,0
4279,AIIMS (Indian medical institute) team has said that Toddy has medicinal properties to cure coronavirus,0
2012,@Styx666Official All they got in China is powdered tiger dick and rhino horn,2
2070,"2020 gotta chill and not wipe us all from the map. We’ve had so far fears of WW3, an earthquake, and news of a deadly virus outbreak from China. And no surprise, it’s still January",2
1869,"i got a refund for that itabag i ordered back in oct. there was a 2nd delay bc of the virus outbreak going on maybe i'll be able to order that bag again some other time, it really was my fave bag for an eva/reberserk theme",2
2100,"Humans have used aromatherapy for thousands of years. Ancient cultures in China, India, Egypt, and elsewhere incorporated aromatic plant components in resins, balms, and oils. They were known to have both physical and psychological benefits. Get 25% off https://t.co/VAlGLre7Ff https://t.co/VOJUEJSuqq",2
6720,Frequent or excessive alcohol consumption can project you against COVID-19,0
3474,China Seeks Court’s Approval To Kill 20000 coronavirus Patients,0
2462,"Please go buy a ‘3M’ N95, N100, or P100 mask today! The coronavirus is likely transmitted via air particles and breathed into lungs. The only possible cure is being proactive. #wuhan #wuhanvirus #coronavirus #WHO #pandemic #globalpandemic #virusoutbreak #besafe #praying https://t.co/Ka6PneXTta",1
3637,There is no space in the hospitals in Italy because of which people are crowding outside,0
38,"The White House sent out text messages in mid-March 2020 informing people that a ""mandatory quarantine"" in U.S. would start within 48 hours",0
6429,It's only a matter of time before there's a serious epidemic of some kind. This could be the prelude to one. It's no laughing matter and no joke. We must prevent and defend at all costs or many people will die,0
634,"Life Time Fitness CEO Bahram Akradi said Wednesday his company will be forced to furlough almost all of its workforce if Congress doesn't act and President Trump is unable to set an ""end date"" for the economic shutdown caused by coronavirus",1
6884,methanol can cure coronavirus,0
2058,"The audacity of Joe Biden to be involved as VP in going after JP Morgan 4 doing in China EXACTLY what Joe did in Ukraine w/his son boggles my mind. I see Joe not as Uncle Joe, but as a creep unworthy to represent 🇺🇸 in any capacity, a wolf in sheep’s clothing. Read the article. https://t.co/8GtS6Wf1if",1
3998,"A video viewed tens of thousands of times on Facebook and YouTube purports to show billionaire businessman Jack Ma praising China’s response to the outbreak of the novel coronavirus, COVID-19",0
2092,Both of our Factories in China are required by the Government to remain closed until after Feb 9th due to the Virus Outbreak. Unfortunately this means our Restocks won't be until After This Date But we still have most things in stock. We hope everyone is and remains safe &lt;3,1
200,"If someone sneezes with it, it takes about 10 feet before it drops to the ground and is no longer airborne",2
5307,Not “There’s magically already a vaccine available.”,0
2899,"A scam is asking people to input the personal details, including bank details, to receive “Covid-19 Relieve.”",1
2784,"@vurnt22 Coronavirus appears to transport with the wind. Just like flower seeds, it can drop anywhere. One theory is the deforestation methods helps spread it. Either way, it keeps spreading until a vaccine is available",2
5651,"It’s too early to know if #fluseason has peaked, but as long as flu is still spreading in your area, a #flu vaccine is the best way to reduce your risk of flu. If you do get sick with flu, #antivirals can treat flu and prevent serious complications: https://bit.ly/2SO61Ty",1
6986,"?a researcher said to be from Zanjan University in China, saying you should take as much vitamin C as possible to protect yourself from the virus",0
5354,"Desperately sad to see Qld LNP and PHON senators pushing climate conspiracies in Parliament. If they did this for COVID-19 they'd be condemned, but apparently climate denial is acceptable",1
4675,Photos of Muslims in Italy allegedly praying outside because of the novel coronavirus,0
2615,"@JiggIypuffdaddy @rdhesselbrock On the other hand coronavirus is a zoonosis, we know that many animals are sources of different coronaviruses and that authorities like WHO are warning about the possible viral risks of raw meat... https://t.co/3ZryszFL5d",1
5416,"Protect yourself and your community from coronavirus with common sense precautions: wash your hands, stay home when sick and listen to the @CDCgov and local health authorities. Save the masks for health care workers. Let’s stay calm, listen to the experts, and follow the science",1
5362,"But bothers me about isn't that a politician is clueless how vaccines work, but that power corrupts those around him, with somebody willing to say ""probably not"" instead of the right answer ""not""",1
