id,sent0,label
898,Minnesota Gov. Tim Walz announced that he is in self-quarantine after coming into contact with an individual who tested positive for the novel coronavirus,1
1864,Don’t forget to use N95 mask https://t.co/W5RP2qhaWC https://t.co/dHPurBy3oe,1
1096,The British citizens trying to flee China,2
3501,Davao City Mayor Sara Duterte said that local government units (LGUs) should be blamed for why the P200-billion cash assistance has not reached constituents,0
401,"Kelly Alexander says ""most"" NC legislators are in the ""high risk age group"" for coronavirus",1
2250,A must-read for all!! Do share as much as you can! #Coronavirus #CoronavirusSymptoms #Wuhan #China #coronavirusindia #Coronavirustoronto #coronavirusaustralia #coronaviruschina #CoronaVirusCanada https://t.co/dZJEupzmIx,1
5697,MERS is another strain of the Corona Virus -,1
6872,"coronavirus started in the ""Luhan Province"" in China",0
1262,Worried Chinese tourists don face masks to visit Windsor Castle,2
1448,"A man under federal investigation for plotting an attack at a hospital believed to be treating coronavirus patients was shot and killed Tuesday during an FBI operation to arrest him, people familiar with the investigation said",2
6861,AmitShah is missing.,0
6824,"BJ: ""I was at a hospital where there were a few coronavirus patients, and I shook hands with everybody"" (you have to watch the video for the full Boris Johnson waffle effect.)",0
5482,"RT @ChrisMurphyCT: It’s just mind blowing that we are two month into this crisis, and less than 5,000 have been tested",1
1712,The pandemic has affected the flow of seafood from foreign markets. Crab legs have been contaminated with the novel coronavirus,0
2653,CORONAVIRUS UPDATE: What is #China hiding? And how should the #US military prepare for quarantine? https://t.co/scBf83RSc1 #USA #America #truth #WorldNews #news #coronavirus,2
489,"Pope Francis has tested positive for coronavirus after he fell ill in Italy and was forced to cancel a religious retreat near Rome … The first results for Covid-19 came back negative, and second came positive, according to Italian newspaper Il Messaggero this morning",0
1170,Hong Kong and mainland passengers descend on West Kowloon station ahead of widespread suspensions to cross-border travel,2
4751,Video says “the coronavirus was invented and patented in the USA and then planted in China.”,0
1336,Chinese private school pupils face coronavirus quarantine if they travel home,2
274,Avoiding ice cream and other cold foods can help prevent the onset of the virus,0
6051,"""excuse me, sir, i'm looking for the famous Wuhan wet market. i seem to be lost and i don't speak or read Chinese.""",2
5875,Wuhan’s mayor said rules imposed by Beijing limited what he could disclose about the threat posed by a fast-spreading coronavirus that has killed dozens of people and infected thousands,2
4599,"A Twitter page claimed shaving of facial hair ensures safety from COVID-19, further attributing the message to the CDC",0
6507,"5 Million People Left Wuhan, China Before Travel Restrictions Imposed",0
4408,Coronavirus patients are being caught on highways in China,0
2526,@BNODesk Unless this bio weapon is not 100% deadly then by next week China will start to disintegrate as a functional nation state,2
3276,"A screenshot of a World Health Organization (WHO) webpage has been shared in multiple posts on Facebook, Twitter and messaging app Line alongside a claim it shows international health authorities raised Thailand’s pandemic stage to a “level 4” during the novel coronavirus crisis",0
4145,MOSTLY “Italy has decided not to treat their elderly for this virus.”,0
6483,"I been to Wuhan and at the time i was there, so much life was thriving. It's scary to see it look like a ghost town",0
776,"ICE deports illegal immigrants to Central America, brings back Americans stranded under coronavirus measures",1
1536,"""You pick the 26,000 people who are going to die because you only sent 400 ventilators"" New York Gov. Cuomo criticized federal response to coronavirus, saying the Federal Emergency Management Agency sent the state 400 ventilators — but they need 30,000",2
4030,WalMart reducing hours of operation,0
195,"California is going to be quarantined. “State borders are closing because of the number of cases in CA,” it reads. “Businesses will close and we will only be able to move about for certain things not sure what.”",0
3240,You shouldn’t open your windows,0
2359,Michelle: you can’t buy boba bc you’re gonna get the coronavirus bc it’s from Chinese people 🤦🏻‍♂️🤦🏻‍♂️🤦🏻‍♂️🤦🏻‍♂️🤦🏻‍♂️🤦🏻‍♂️🤦🏻‍♂️🤦🏻‍♂️,2
5981,China #coronavirus: evacuation begins of US and Japanese citizens in Wuhan – live updates,2
3756,A Twitter user claimed that Russia released 500 tigers to keep people inside during lockdown,0
5040,"In surgical masks, the white filter side is supposed to be worn outside and the colored on the inside",0
5724,"Chinese authorities’ control of information has been amazingly effective. Last week when I spoke to friends in Wuhan about #coronovirus , they dismissed what I said as fake news. Now they are trapped in the city, a giant cage guarded by policemen and soldiers",1
6342,People in Wuhan are self-quarantined because of the #coronavirus outbreak,1
32,"U.S. federal government will support for free coronavirus testing, paid sick and family leave, and food assistance for poor families",1
949,"Churchill Downs postponed the Kentucky Derby until September, the latest rite of spring in sports to be struck by the new coronavirus along with the Masters, March Madness and baseball season. Instead of May 2, the race will be run Sept. 5, kicking off Labor Day weekend",1
5349,it’s as though @realDonaldTrump was a narcissistic psychopath,1
1601,"Home minister Amit Shah has contracted Coronavirus. Last week he had visited Italy, and did not get tested after coming back causing further infection",0
2696,"@lopezdoriga Mientras tanto en Canada: ""The federal government has now secured a plane to help bring citizens stuck in the epicentre of the novel coronavirus outbreak back to Canada from China.""",2
2641,Oman Air says it is in constant touch with airline regulator PACA. @omanair https://t.co/GQXmqyO8Hf,2
4649,Post says starting in March if you travel outside of the United States you won’t be allowed back in the country “due to high risk of the coronavirus.”,0
6643,Some other weird virus circulating in Nigeria,0
2285,"Although we are in Indonesia, we are always carefull of Corona Viruses Out Break with always wear a mask when going outside house or in public places because it's only our self can prevent that viruses! #CoronaDiantaraKita #CoronaAlert #CoronavirusOutbreak",1
1939,"@RichardEngel @TrueFactsStated I think as the infections continue to explode in countries other then China it will be considered a pandemic, isolated cases in other places do not make it a pandemic, huge jumps in those places do",1
2553,"@Bustn_Airs @VetsUnitedMarch @BrookeM_Feldman This CDC graph was BEFORE the new warning about NSAIDs and sudden cardiac arrest, and also when illicit opioid deaths were being conflated w/street drugs...So there's that. I think NSAID risks are being downplayed intentionally now. 🤔😔 https://t.co/hPvFRBBKiJ",2
1861,"A man coughs on a bus. The whole bus is looking at him. Conductor: Do you have a coronavirus? Man: No, what are you? I have tuberculosis! Conductor: Well, thank God",2
728,"Chicago will reserve at least 1,000 hotel rooms to quarantine coronavirus patients, offering relief to hospitals filled beyond their capacity",1
2087,I am the reason why China needs a wall. I'm planning to put forward certain policies to prevent this. NOTHING WILL EVER SATISFY THEM,2
6508,Wuhan Coronavirus Infections Could Be 30 Times Higher Than Official Total,0
3732,MOSTLY Says Nancy Pelosi’s coronavirus bill includes “tax credits for solar and wind energy … retirement plans for community newspaper employees … $300 million for PBS … climate change studies” and more,1
1315,Coronavirus tally in epicentre Wuhan may be ‘just the tip of the iceberg’,2
843,Massachusetts officials announced that hundreds of day care sites will open to accommodate those who are forced to work during the coronavirus pandemic,1
3559,Image with the narration to claim that a huge number of Muslims were roaming in Beruwala City in Sri Lanka during curfew risking the lives of many amidst COVID19,0
405,"President Donald Trump will soon lock down the entire country to prevent the spread of COVID-19, which had infected 4,226 people in the United States as of March 17",0
414,Gaetz and Cruz both placed themselves in self-quarantine after coming in contact with a person who tested positive for the coronavirus at a conservative political conference,1
346,Drinking and gargling water everyday will cure the new coronavirus,0
5365,"Fox News' Jesse Watters claims that the coronavirus started because Chinese people ""have these markets where they were eating raw bats and snakes""",1
1783,"A video shows how the Chinese police and doctors are detaining Coronavirus patients on the highway. We can see a team of police in hazmat suits forcefully restraining a man as he refuses to cooperate with officials when his car is stopped. As the man begins to drive away, he is stopped by a police van and surrounded by men carrying riot shields. As he gets out of his car, a net is thrown over his head and officials grab him",0
1812,A circular attributed to the Medical Council of India (MCI) is being circulated to state that all Government and Private Medical Colleges are advised to recruit MBBS undergraduate interns and students of part 2 third MBBS starting 3 April,0
5176,Statistics are predicting millions of dead people and billions of infected people in a few days,0
5929,BREAKING NEWS (SOURCES): A top admin official at George Mason University is telling me at this hour that one student from #Wuhan who has a possible case of #coronavirus is refusing to see a doctor…,2
5489,If you’re looking for hysterical coverage of the Coronavirus then go to the Drudge Report,1
66,You can get the coronavirus by drinking Corona beer,0
5633,"Chinese authorities say the outbreak began in a seafood and live-animal market in the city of Wuhan. The Washington state patient, a man in his 30s, had traveled to Wuhan, but says he did not visit the market in question or know anyone who had the virus",1
6073,Wilbur Ross: Coronavirus Could ‘Accelerate The Return Of Jobs’ To America https://dailycaller.com/2020/01/30/wilbur-ross-coronavirus-jobs-china-america/ …,2
6465,"This report's key findings are alarming. The authors predict that by 4 February up to 250,000 people in Wuhan could be infected by the corona virus. The virus will also further spread to other transport hubs like Beijing and Shanghai. #WHO the time to act is now",0
7169,Indian actor Shah Rukh Khan donated money to Pakistan to fight Coronavirus and did not help India at all,0
914,Automakers start helping production of medical equipment for coronavirus fight,1
1330,"""Coronavirus may disrupt China’s diplomatic agenda, US trade deal, observers say""",2
4860,This photo shows a new case in New South Wales,0
5013,The new coronavirus can be cured by drinking one bowl of freshly boiled garlic water,0
2075,"@laurasessions10 @saralynne65 Donald Trump is making an effort to hide the U.S. Victims of the Coronavirus from the American People &amp; has told us the Coronavirus is a “Hoax”! Trump has No Credibility, because he constantly Lies, so the American People should not believe him! Americans are Dying! https://t.co/5qEaPBdWA0",2
2537,"""Chin up, China!"" ""China, yes you can!"" ""China, you can do it."" With colored pencils and paper, children and teenagers from across Latin America draw messages of solidarity and encouragement for the Chinese people. #FightVirus https://t.co/tyaTi2PyUU",1
1595,"Police in Spain were roughing up civilians to enforce a lockdown due to the Coronavirus, with brute force. A caption reads 'This is lockdown in Spain. You guys in India are lucky...u just get caned'",0
2804,"Stated preference: we’re too atomized, loneliness epidemic, more community, close-knit family ties, bring back churches, civil society! Revealed preference: we want privacy, autonomy, more room, internet/smartphones, more time alone, fewer social constraints, UberEats, Netflix",2
5484,"My mom putting coronavirus hype into perspective: ""Many more people die of preventable starvation but the rich cannot catch that.""",1
6040,The death toll related to the Wuhan coronavirus now stands at 131 in mainland China,2
3110,Ministry of Economy and Finance in South Korea and pharmaceutical companies had a secret meeting,0
5614,"The first human infection with new #coronavirus (#2019-nCoV) has been reported in the US in a person who recently traveled to Wuhan, China. Additional cases in travelers have been reported in Thailand, Japan, and The Republic of Korea",1
5462,"We have a perfectly coordinated and fine tuned plan at the White House for our attack on CoronaVirus. We moved VERY early to close borders to certain areas, which was a Godsend. V.P. is doing a great job. The Fake News Media is doing everything possible to make us look bad. Sad",1
2027,Terms of Trade: Hong Kong exports limped into the teeth of the China virus storm https://t.co/kl2PiZfi94,2
156,President Trump is going to announce a mandatory two-week quarantine for the whole country is going viral,0
6628,the coronavirus is just being used to end the Hong Kong riots,0
1526,"New York state is soaring in coronavirus case numbers, higher and faster than anywhere in America. But in recent days, numbers in Louisiana, Pennsylvania, Michigan, Florida and Georgia are also spiking fast, according to a CNN tally of Covid-19 cases",2
939,"Dear Bath & Body Works Customers, with breaking news about COVID-19 constantly developing, our goal has been to make products available to help you care for your families and friends to prevent the spread of COVID-19/Coronavirus as much as we can. But based on the information we have today, we have made the extremely difficult decision to temporarily close all of our stores in the U.S. and Canada",1
4606,Autorities should implement temperature tests to travelers from China,0
2301,"China stimulus hints, slowing spread of virus lift stocks https://t.co/fddZmvZkW2",1
2148,Trump being President is a nightmare https://t.co/zF6x6GbRyb,2
6351,coronavirus doesn’t give you an excuse to be a dick to Asian people,1
6208,"THREAD: The wealth inequality gap is so huge the U.S. resembles China and Russia more than other advanced democracies like the UK. It's pooling in the hands of the nation's billionaires, who are using it to purchase political power",2
2616,"‘They also warn that a patient with negative oral swabs after several days of illness may still be capable of transmitting the virus.’ Super,a ne... Studies show COVID-19 virus likely has multiple infection routes | CIDRAP https://t.co/3IijMDMip4",1
4084,A message chain claim that a message from Stanford hospital gives advice to frink water every 15 mintes in order to prevent COVID-19,0
2933,Video of Canada PM Justin Trudeau’s wife pleading people to take COVID-19 seriously,0
3643,A vaccine for coronavirus has been found,0
6609,"Last week, one of Harvard's most prominent scientists was arrested. He is a participant in China's Thousand Talents recruitment program, an initiative that prosecutors say has been weaponized to steal trade secrets",0
1246,Hong Kong parents demand government cover tuition fees for coronavirus-cancelled classes,2
675,"Star of stage and screen Laura Bell Bundy, 38, has also announced that she's contracted coronavirus. In her Instagram announcement, Bundy said that her symptoms have been ""minor,"" which she credits to ""taking care of"" herself by taking nutritional supplements and herbs prescribed to her by doctors. She also urged her followers to ""stay inside"" to avoid furthering the outbreak",1
2404,[Non-Meteorology] We (in 🇭🇰 Hong Kong) just had the first case of #WuhanCoronavirus 2019-nCoV... The patient is a tourist from #Wuhan... Four family members of him were NOT quarantined but flew to 🇵🇭 #Manila onboard #CebuPacific flight #5J111 today... https://t.co/MsL37dxfs8,1
2570,[UNTV] China records first virus death in Beijing as toll passes 100 https://t.co/iTzZEEncvy,1
1961,@RahulGandhi Mr Rahul please explain my three questions 1 what is your family relations with China and Pakistan 2 why all attacks happened after visit of Congress leaders to Pakistan 3 why Congress government released 40 terrorist in Goodwill gesture,2
4209,Elderly people are left to die in an Italian hospital near Milan,0
5006,Partially 3 preliminary studies who became viral on social networks for wrong reasons,0
2943,Video of an emotional appeal by the COVID-19 patient in Surat who had returned from London,0
893,"Kroger hiring more than 10,000, changing store hours as coronavirus spurs panic buying",1
5699,"TRUTH IN POLICY MAKING: Flavor bans are based on claim that flavors are the driving factor for teen experimentation. CDC data clearly shows this is not true. Notably, teen vaping was down in 2016, but ""curiosity"" spiked between 2017-2019 with media coverage of ANTZ ""moral panic.""",1
5027,"Coronavirus in Arezzo (city in Tuscany, Italy)",0
5942,"""Now It seems clear that [the] seafood market is not the only origin of the virus...."" Up-to-the-minute #coronavirus reporting from @ScienceInsider",2
4553,"Post says two patients at Valley Regional Medical Center in Brownsville, Texas, “are being looked at” for possible coronavirus infections",0
6131,Stop eating meat to stop Corona Virus. Because Corona Virus come from wild or domestic animals. If you meat of it then it(virus) will spread,2
2455,Trump's Nationalistic Response to the Coronavirus - The Atlantic https://t.co/qwTzObmUsc,2
3035,The Sanytol brand is sending an email to give away disinfecting wipes,0
895,Katharine McPhee and David Foster have been performing mini concerts together while self-isolating at home because of the coronavirus outbreak,1
806,Nine female inmates from a minimum-security unit of a South Dakota jail escaped after a separate prisoner tested positive for coronavirus,1
6759,Supermarkets have been using the list to give priority to vulnerable customers,0
4947,"First case of coronavirus in San Vicente del Raspeig (Alicante, Spain)",0
3581,Donald Trump announced comercialization of a vaccine,0
5511,"While China quarantined 56M and Italy is on lock down, Johnson’s 🇬🇧 relied on advisers specialising in behavioral psychology",1
125,COVID-19 is same as flu,0
2635,@JustinTrudeau @jguaido How about you stand with Canada. https://t.co/LDonc2L6nc How can you allow over 1000 people to enter with no protocols in place. Do you even care? I didn't vote for you're our PM... act like it! #coronavirus,2
1741,"Be vegetarian! Do not create viruses like coronavirus, which pose a danger to humanity, by having [meat of] different kinds of animals",0
5058,The Chinese foreign Ministry officially demanded an explanation from the United States due to the fact that containers with biohazard markings were found buried in the evacuated Consulate General in the city of Wuhan,0
3054,Image of herd of deer sitting on a street interpreted as different locations in Sri Lanka and India,0
349,"The WHO advises the public to wash their hands after handling money, especially if handling or eating food",1
6348,This Wuhan hospital is being built in just 6 days,1
4374,This Lysol desinfectant against coronavirus shows the virus is not new,0
1952,"As of 40 mins ago: Corona virus has spread to at least 9,320 people around the world, surpassing that of the Sars epidemic over a year long period (2002-2003). 212 people have died, all in China. There are 98 confirmed cases of infection outside mainland China in 18 countries",1
6546,coronavirus not killer disease,0
5087,China builds a hospital in 48 hours for coronavius patients,0
2994,"Israel has no confirmed cases of the novel coronavirus, COVID-19",0
1106,Goldman Sachs expects coronavirus outbreak to weigh on US economic growth this quarter,2
4522,Turkish raki is prevents COVID-19,0
1859,East London pls https://t.co/qfpyegyw4u,1
4322,Fake coronavirus pandemic is a cover-up for the “5G disease”,0
3646,Image of mother unable to feed her suckling as she battles COVID-19,0
4480,Videograph shows COVID-19 is more dangerous than former outbreaks,0
1733,"""Who would have known that a simple cup of tea would be the solution to this virus."" The Chinese doctor Li Wenliang, who was hailed a hero for his efforts to raise the alarm about the virus early on in Wuhan, and who later died of the disease",0
6247,Coronavirus hitting the golf world. Events cancelled in Asia and sadly there are bound to be more,2
5464,The corona virus made flights so cheap i think it’s finally time to start traveling. Lmaooooo. I’m here for a good time not a long time,1
3223,The lockdown due to Coronavirus has led to the reemergence of a large flock of birds at the riverfront in Ahmedabad,0
2434,"Iranians licking holy shrines in religious tradition, refuse to close sites despite coronavirus outbreak https://t.co/d7BAvZasIa",1
3007,This is the video of Conress leaders Rahul and Priyanka Gandhi breaking coronavirus lockdown by stepping out,0
5082,Facebook page suggests a bowl of garlic cures “Wuhan’s” coronavirus,0
1245,Chinese residents ‘ordered to cull pets amid fears they may spread coronavirus’,2
5523,Internet connectivity is a crucial aspect of business continuity plans during a pandemic. The Principal Secretary IT held talks with service providers to ensure this. Providers have informed that they can raise network capacity by 30% to 40% to meet the surge in demand. #COVID19,1
465,Nancy Pelosi delayed coronavirus funding so “Dems could campaign on it.”,0
3757,Video made by Dr. Mario Pesaresi in which he recomends water steam to deactivite the coronavirus,0
1108,"Ex-Obama health advisor: US needs to 'stop panicking and being hysterical' about coronavirus ""China's deadly coronavirus could be good for US jobs, manufacturing, says Trump Commerce Secretary Wilbur Ross""",2
4045,Coronavirus patient arrested in Punjab,0
2585,"@Tavis88 @Paul_Yeoman @TheJimCornette What’s not ok is people being stripped of constitutional rights without due process, but whatever. Govt knows best lol. And wasn’t there a CDC study on gun violence commissioned by the Obama admin in like 2013? IIRC, the results didn’t fit the narrative",2
6732,"within 48-72 hours the president will evoke what is called as ""Stafford Act""",0
3584,A post claiming that Yangon region in Myanmar will be locked down within 48 hours saying that announcement will come out officially,0
5926,"I wrote a piece on that stupid bat video, and the frequent racism of stories blaming Chinese eating habits for disease",2
1171,Coronavirus is ‘rubbing salt into the wounds’ of Hong Kong’s tourism industry caused by anti-government protests,2
6506,I know its supposed to be all fun and games on stan twitter but the death told for the Wuhan coronavirus is rapidly increasing and its contagious without symptoms so please be washing your hands frequently and keeping your mouth covered if you’re in areas with any confirmed cases,0
4288,Malaga closes nurseries due to coronavirus,0
6238,"WHO is offering two online trainings to support the response to the #2019nCoV outbreak. They are available on the open learning platform, http://OpenWHO.org WHO Situation Report 9 February 2020 http://bit.ly/2Hb26cy",2
6124,BREAKING: Delta Air Lines and American Airlines are suspending all flights between the U.S. and China as the coronavirus outbreak spreads,2
210,"While staying hydrated by drinking water is important for overall health, it does not prevent coronavirus infection",1
2017,"@Maryam_Rajavi Over 1,500 have died of #coronavirus in #Iran. Now fatality has gone out of control. At least 400 have died in the city of Qom, known as Iran's #COVIDー19 epicenter. @UN intervention is needed to contain this tragedy @antonioguterres @DrTedros @SecPompeo https://t.co/d951HtY8l7",1
1736,Cow urine and dung are traditional remedies for various diseases including the coronavirus,0
6048,All flights to and from China should be banned without further notice. Coronavirus is a created epidemic by the Chinese government. Biological weapons research and testing must be totally banned https://twitter.com/ANI/status/1222913649896914946 …,2
2140,@PMBreakingNews @cswany2 It looks like a smoke machine. China is known to overact with not too many testings. Whatever they're spraying I hope it doesn't cause more harm than the CoronaVirus,2
6639,China slowly returns to work as coronavirus toll hits daily record,0
6446,China had hundreds of people infected by the Wuhan Coronavirus outbreak last year and kept it quiet for months,0
4637,An aritcle of El Pais says ther is a case of coronavirus at the School of Architects of Madrid,0
1815,Crowds defying lockdown in Hyderabad near Charminar on Friday demanding to perform Namaz,0
415,"As a Florida state representative, Gaetz voted for a 2013 bill to ban cities from requiring employers to offer paid sick leave",1
5316,"Where there is a will.. Wuhan to build 1,000-bed hospital in less than 12 days to ease bed shortage due to #WuhanCoronovirus. City says mobile hospital, with floor space of 25k sqm, to be finished before Feb 3. Construction started last night, state media reports",1
5005,The common flu kills 60 times more people annually than the coronavirus,0
