id,sent0,label
6139,China is suffering the fatal effects of corona virus due to eating meat by breaking the constitution of God,2
6116,Foreign nationals who have traveled in China within the last 14 days will be denied entry into the US as of Sunday,2
6868,Mosquitoes transmit COVID-19,0
4058,"Flu vaccine increases coronavirus risk 36%, says military study",0
2880,A military Humvee labeled “COVID-19 quarantine team” was on Interstate 696 in Michigan,0
4869,Bill Gates predicted coronavirus,0
1935,@scorpysz @ZoinksScoob13 @tdsb Toronto District School Board: Cancel all TDSB schools for 2 weeks as a precaution to the Coronavirus - Sign the Petition! https://t.co/Nxj26t9xmI,2
5397,The outbreak is forcing many companies that have been slow to adopt tools such as remote collaboration to reconsider the benefits,1
3317,Videos showing police raids or army raids against people who don’t respect confinement measures in Algeria or Morrocco,0
4612,A post says that a “poll finds 38% of Americans Say They Will Not Drink Corona Beer Because of Virus.”,0
5606,Corona will not touch you. Say amen,1
3920,Staff of two Mumbai hotels have COVID positive cases,0
972,"The California based rock band Green Day announced a cancellation of a tour in Asia due to the virus, but said new dates would be announced shortly",1
4719,WHO considers canceling Mecca’s pilgrimage,0
419,The WHO never offered to sell test kits to the United States,1
3237,Johns Hopkins University says that the fatality of coronavirus in Colombia is the third lowest in the world,0
411,Drinking teas can prevent the coronavirus,0
3462,Photos of coronavirus patients being treated on the road in Italy,0
3853,Egyptian doctor has invented a fluid to treat coronavirus,0
2258,Salute to all the health workers in China. Theirs are acts of valour second to none! https://t.co/OuINgAtks9,1
6870,"Lenox Hill in New York among many hospitals already using Hydroxychloroquine with very promising results. One patient was described as ""Lazarus"" who was seriously ill from COVID-19, already released",0
791,A makeshift morgue has been set up outside a New York City hospital as the spread of the coronavirus is accelerating in the Big Apple,1
657,Italian engineers help coronavirus patients by harnessing snorkel masks for CPAP machines,1
524,China air quality projections used to promote coronavirus cremation hoax,0
3948,With self-checkup you can find out if you are infected with coronavirus,0
6976,China covered up the virus and arrested a doctor who warned about the virus,0
5960,"A chartered jet carrying U.S. consulate employees from Wuhan, China, the center of the #coronavirus outbreak, is set to land in Ontario this week",2
4466,This is a picture of the first Moroccan infected with the virus,0
2900,Japanese drug Avigan is effective medicine against COVID-19,2
4416,Partially Claim that photos show dogs being killed in China as part of efforts to combat COVID-19,0
4483,"Post says “man visited Albany, N.Y. days before dying from coronavirus.”",0
2174,Kojima Productions has made the difficult decision to cancel our participation at the 2020 Game Developers Conference due to increasing concerns related to coronavirus. (1/2) https://t.co/K6FJtq5Tpx,1
2864,"“If @StateDept claims the mounting global questions about US role in #COVID19 pandemic are mere ""Iran-made conspiracy theories"", then US must answer some of these questions asked by the Global Research.”",0
1311,China says good communication with Taiwan on coronavirus,2
6503,Today is Day 27 (higher than that) of the Wuhan Coronavirus outbreak. The US hasn't stopped people from China from entering the US. And the WHO still hasn't declared the Coronavirus a Public Health Emergency of International Concern,0
4554,MOSTLY The United States is “actually screening fewer people (for the coronavirus than other countries) because we don’t have appropriate testing.”,1
2649,"@BaldingsWorld My Chinese friends in China already told me that weeks ago. It's just incredible, even if the use VPN, they only use it to watch porn or business. There's no hope. The few who understands what's really going on only want to immigrate. China, a 1.4 billion people jail",2
4091,Graphics with information about COVID-19 containing Unicef branding and inaccurate information,0
4190,"The Minister of Defense of Japan posted a tweet to thank Taiwan for donating 500,000 face masks",0
40,New York Governor Andrew Cuomo called the federal government’s response to the coronavirus outbreak “absurd and nonsensical.”,1
1832,"‘Office Memorandum’ claims that the Ministry of Health & Family Welfare has issued a clarification regarding declaration of holidays in four states, namely Maharashtra, Gujarat, Uttar Pradesh, and Sikkim",0
3839,“coronavirus victims are buried in the morning this Wednesday in Italy. Rest in peace”,0
2982,"“It is about some groundless accusations. In fact, this Russophobic obsession could be expected to fade under the current situation, but it doesn’t seem to be fading,""",0
2155,"#cse252schlpriv The CON team of the privacy debate looks at the current ineffectiveness of current flagging technology taking away from resources, like mental health programs and metal detectors, that could be effective to solve the school shooting epidemic",2
3905,A man is touching a push-cart with his tongue to spread the virus outside Lidl in Lithuania,0
5475,Just got an email from UCONN saying that if you get the coronavirus and exaust your 3 sick days per semester you have to use vacation days or personal leave days to recover. This is how you get people to come back to work when they are still contagious,1
681,"As healthcare workers across the country confront a shortage of personal protective equipment amid the COVID-19 pandemic, one central New York couple has found a solution: 3D print them",1
2885,CLAIM: They try to spread the new coronavirus (Covid-19) through Coca Cola,0
1825,Police Punishing in highway Roaming freely in Assam Bandh. Punishing ... Disobeying Lockdown. of CORONA-VIRUS,0
2605,"Regardless of where one stood on the sensitivity of this event, the fact that the university stepped in to investigate the students who held this event is worrisome.https://t.co/uVOqxg4V3n",1
1397,"New Rochelle’s coronavirus trajectory “gives us some reason for cautious optimism,” says Mayor Noam Bramson. “Because of those early restrictions, we’re now seeing some indication that the rate of increase in the virus is moderating.”",2
4646,Drinking water every 10 minutes can send the virus into stomach and kill it,0
6932,The COVID-19 test kits donated by Chinese government are inaccurate,0
5619,"CDC has been proactively preparing for the possible introduction of #2019-nCoV in the US in a traveler from Wuhan, including on Jan 8, alerting clinicians to watch for this new virus, & on Jan 17, providing more guidance to public health partners",1
1110,Asian markets recover a little after coronavirus fears sunk stocks,2
6289,"Taiwan President Tsai @iingwen has weighed in, urging the @WHO not to exclude Taiwan over ""political factors."" She also called on China to handle the #WuhanCoronavirus outbreak in an open and transparent manner",1
4915,Xi Jinping visits mosque for coronavirus,0
529,MashaaAllah hundreds converted to Islam in Philippines after it’s proven that the coronavirus doesn’t affect Muslims,0
2952,Tea can cure or alleviate novel coronavirus (COVID-19) infection,0
4150,A photo claimed that a Lithuanian town of Mazeikiai is being cut off from the rest of the country due to outbreak of COVID-19,0
2697,"@WSJ Walter Russell Mead @wrmead @WSJ editors publish《 China is real sick man of Asian》use vicious words attack Chinese people in this grief moment still self isolation to protect more people in the world,They don't have any conscience of humanity.https://t.co/FLaj934S5V",1
4082,Cristiano Ronaldo turned his hotels into hospitals,0
4509,The government — or specific states such as Michigan or Florida — has mandated that employers and schools close for two weeks,0
5069,Video shows a doctor falling down due to coronavirus disease,0
5263,China “stole coronavirus from Canada and weaponized it into a Bioweapon.”,0
4351,SARS-CoV-2 can be killed over 37 degrees Celsius,0
711,Judge denies Tekashi 6ix9ine's request to serve out sentence at home amid coronavirus fears,1
6071,Jared Kushner arranged an investor meeting on the sidelines of Pres. Trump's 2017 trip to Asia,2
5758,"Hospitals in #China over “overwhelmed” due to the #CoronavirusOutbreak, and a 1000-bed mobile hospital reportedly will be built in #Wuhan (the epicenter) within 10 days(!). Unfortunately, this outbreak will get worse (likely MUCH worse) before it gets better",1
5723,Did anyone notice that #China just quarantined 20 million people by confining them to three cities to contain the outbreak of a new #virus? Sounds like the opening scene of a #zombie movie..,1
746,Police officer in San Diego helped a 95-year-old man by going to get groceries and food for him during the coronavirus pandemic,1
4028,Coronavirus is the least deadly virus,0
6857,Abu Dhabi DoH says news of residential area case is untrue,1
5234,Food and locations are contaminated in Australia,0
5036,Garlic water can cure coronavirus,0
1137,Suspected coronavirus patient is wheeled out of a Chinese airport in a see-through quarantine box,2
4642,"Honduras’s first confirmed case has traveled to Taiwan earlier, which means there is a severe community transmission in Taiwan",0
1947,"#WhatWouldJulianSay China expels 3 of Rupert Murdoch’s 'Wall Street Journal' stenographers, citing racist headline → https://t.co/ZLgRGThAec https://t.co/Ns31cf4EXg #FREEAssange",2
6153,India’s Second rescue mission successful,2
1348,"Coronavirus: in Taiwan, the deadly virus is the H1N1 flu",2
600,Alyssa Milano is calling on President Donald Trump to convert his hotels in the United States to hospitals to help sick people during the ongoing coronavirus pandemic,1
1798,"Coronavirus has infected boiler chicken as well. We appeal to all the citizens not to consume boiler chicken meat. This appeal is from the Muslim community, Khar, Mumbai",0
5663,First Patient With Wuhan Coronavirus Is Identified in the U.S,1
6332,Chinese Premier Li Keqiang arrived in Wuhan on Monday and is touring hospitals,1
2517,This Is How China Is Rigging The Number Of #Coronavirus Infections | #virus #truR0 https://t.co/EMjQTfEhaf,1
1038,"Javier Ortega Smith, the secretary-general of the far-right Vox party, tested positive on March 10, causing the suspension of Spain’s lower house of Parliament. The leader of the party, Santiago Abascal, later tested positive",1
1268,Wuhan woman screams as Chinese authorities barricade her inside own home,2
4264,“‘The Simpsons’ predicted Tom Hanks getting coronavirus in 2007.”,0
3685,Did an American die because he self-administered chloroquine ,0
4705,"Video shows the suspected infected people in eastern Turkey, Van",0
778,California teen’s suspected coronavirus-related death would be one of youngest in US,1
4533,Plant-based cure for coronavirus discovered in Iran,0
4871,"India scientists found: HIV gene is embedded in 2019-nCov, which is China’s bio-weapon",0
5880,"""The data you read online is only what the government want you to know. #Wuhan is doomed. We are short of medical supplies and almost unprotected. This thing has existed since Dec and the government has suppressed the information""",2
1764,Paracetamol can treat coronavirus infection,0
5611,"China's contagious killer virus comes to the US: American man in his 30s is hospitalized in Washington state with SARS-like coronavirus after visiting Wuhan, CDC says",1
5152,"A coronavirus case diagnosed in Atasehir hospital, Istanbul",0
254,Comedian Sam Hyde was responsible for the spread of the new coronavirus,0
6859,"A social media post is saying a Newberg student has coronavirus. This is UNTRUE. At this time, no Newberg staff or student has the disease. SCHOOLS WILL BE OPEN ON MONDAY. We encourage any student or staff who is ill to remain home to slow the spread of any flu or virus",1
6404,China’s contagious Killer virus comes to US: American man his 30s is hospitalized in Washington state with SARS-like coronavirus after visiting Wuhan,0
6514,"210,000 vehicles escaped from the city the day before #Wuhan's lockdown",0
4054,"MOSTLY “Now, as it stands, our health care system has adequate ventilators, ICU beds, medical professionals.”",0
82,"An MSNBC reporter said on air: ""I hope enough people die from coronavirus that it harms Trump's reelection.""",0
3933,Medical University in Vienna has published a study regarding ibuprofen and coronavirus,0
6981,"MYTH: China's hospital, supply shortage endangered peopleFACTS: StethoscopeAll treatment is free HospitalMultiple hospitals built in 1-2 weeks Soccer ballSports venues converted to hospitals ''''?? 42k medics sent to Hubei Factory Thousands of factories refitted to produce masks, respirators, supplies",1
141,Stocks plummet amid coronavirus fears and oil-price crash,1
7082,"that Kenyans want a lockdown to contain Covid-19 are false and fabricated. Who are these Kenyans? Is GoK able to provide every household with food, water, medicine, gas and electricity for the period of the lockdown",1
6787,"Is coronavirus transmission instant? Does it kill humans instantly? According to the WHO, ""The incubation period means the time between catching the virus and beginning to have symptoms of the disease. Most estimates of the incubation period range from 1-14 days.""",1
2254,"I've heard so many radio presenters &amp; the like casually say things like ""I don't wash my hands all the time and I don't get sick"" or ""I don't really know how #Coronavirus spreads I guess it's -insert ignorant nonsense-"" etc... this is so damaging to public health awareness. Stop",2
3550,"By e-mail sent to major newsrooms, Portuguese government announces cancellation of great projects of airports, due to the finantial restrictions caused by the impact of coronavirus",0
6054,Export controls emerge as way to curb China’s rise,2
1417,"Dr. Anthony Fauci: ""We are hoping ... that we will see that impact of warmer weather on bringing the infection rate down. But you can't guarantee it because this is a brand-new virus.""",2
515,"Charlie Kirk stated on February 24, 2020 in a tweet: “Three Chinese nationals were apprehended trying to cross our Southern border illegally. Each had flu-like symptoms. Border Patrol quickly quarantined them and assessed any threat of coronavirus.”",1
2825,@marcorubio Your boss won’t let the head of the CDC speak without pre-clearing the message,2
3244,Marathi newspaper reports conspiracy theory of Coronavirus being a bioweapon,0
2169,Li Wenliang: 1986-2020 Chinese doctor who risked everything to warn the people of China about the new virus. Then he gave his life saving as many as he could. #2019nCoV #LiWenliang https://t.co/7mPaWs517w,1
3022,Video of a man who committed suicide in US due to COVID-19,0
6672,the coronavirus is an engineered bioweapon,0
6373,If you’ve got concerns about Coronavirus you can find out more on the government website,1
1739,"A mixture of the ayurvedic herb giloy, turmeric and basil leaves could help prevent coronavirus",0
7002,hospitals have never set up surge tents before,0
5952,"#WR: The delay allowed the disease to spread rapidly as medical staff took fewer precautions. One patient with coronavirus reportedly infected 14 hospital staff members in Wuhan. """,2
3217,"COVID-19 was invented and patented years ago by the Institut Pasteur, a French medical research center",0
232,"In case you missed it, yesterday, Federal Agents arrested Dr. Charles Lieber, chair of Harvard University’s Department of Chemistry and Chemical Biology, with lying to the Department of Defense about secret monthly payments of $50,000.00 paid by China and receipt of millions more to help set up a chemical/biological “Research” laboratory in China. Also arrested were two Chinese “Students” working as research assistants, one of whom was actually a lieutenant in the Chinese Army, the other captured at Logan Airport as he tried to catch a flight to China – smuggling 21 vials of “Sensitive Biological Samples” according to the FBI. Oh, almost forgot. The research lab the good professor had helped set up? It’s located at the Wuhan University of Technology. Wuhan China is ground zero to the potentially global pandemic known as the “Coronavirus”which is both spreading rapidly and killing people",0
6294,Dingell pens a letter to CDC with questions on airport travel concerns and virus outbreak,1
3020,A Whatsapp forward claiming all calls will be recorded by the Indian government.,0
1355,"""Disturbing footage shows snakes, bats and possums sold openly at a Wuhan market""",2
1462,Americans are stockpiling eggs during the coronavirus crisis as they cook more meals at home,2
1818,"In India, all posts related to coronavirus have been ‘declared a punishable offence by the Central government’ and that only a government agency is permitted to post on coronavirus",0
6025,"China Closes Foxconn, Johnson & Johnson, And Samsung Factories Amid Virus Outbreak",2
3371,A Video Shows Chinese Celebrating Overthrowing coronavirus,0
820,Yelp adding donation buttons for restaurants and businesses shut down due to coronavirus,1
4489,Ads selling masks protecting against CoV,0
5371,"I hate to say I told you so but, China is still lying",1
2791,@HistoireSecrete @DrEricDing He said 2.6???? and we still do not know the real numbers do to #China not telling us the truth. Why lock 40m + in there cities if its less than the flu!!!!! #coronavirus,2
4943,Health Canada has advised that by keeping the throat moist (by drinking water) can help preventing infection,0
4552,Post says “sanitizer will do nothing for the coronavirus.”,0
1883,It’s coming https://t.co/JsGmlmyKwC,1
762,The Senate stimulus compromise package aimed at helping Americans cope with the economic woes caused by the coronavirus crisis includes millions for the arts,1
2198,"@Asmali77 The questions we must address now in regards to the #COVD19 #coronavirus #COVID-19 are many, very many",1
1138,Satellite images show construction of Wuhan hospitals,2
3692,Cigarette smoke spreads coronavirus,0
5532,RT @Nazeefah: COVID-19 helping people realise that some meetings can be emails,1
6768,Israel has had no deaths from coronavirus because people in the country have been cured by drinking hot water with lemon and bicarbonate of soda at night,0
5415,"Congress has agreed to provide $8 Billion to fight Coronavirus! This means @CDCgov, @HHSGov, and @DHSgov will have the resources they need to Keep America Safe and keep the risk to workers and families very low. This is great news for our Health, our Economy, and our Nation",1
1944,"The new coronavirus is in the same family of viruses as SARS, MERS and the common cold. What to know about the virus and its symptoms: https://t.co/UUrLlwLuwT https://t.co/ouR8zPuoRf",1
1905,Facebook fights spread of misinformation about virus online https://t.co/HdyQjRuKnW #coronavirus #media #technology,1
2025,"I hope this isn’t true, but we know China’s censors and authoritarian approach make it harder to trust their official statements and counts. https://t.co/6TgmPQDyVt",2
5860,"It would be a wonderful gesture for @realDonaldTrump to travel to Wuhan, China, to show our confidence and support of China’s efforts",2
3741,Photographs shared hundreds of times online purport to show the coffins of Italian victims of the novel coronavirus pandemic,0
4014,Christine Lagarde says the elderly are living too long,0
77,Videos show people collapsing on the street due to coronavirus,2
2638,Typical that there’s people freaking out about the corona virus and the changed attitude towards Chinese/Asian people. #media #predictable https://t.co/5llJh6AaYy,1
3469,"On WhatsApp a video circulating of Rabbi Dan Ben Avraham, International President of the Netzarita AMI Alliance, according to their Twitter. In the video, the rabbi says that “the Israeli Minister of Health has officially declared that Israel has the coronavirus vaccine.” And sentence, “Israel has the vaccine already.” But this is not true. Although Israel is working on a vaccine, it is not ready yet",0
3785,Korean drama predicted the occurence of COVID19 in 2018.,0
2362,"@VandanaJayrajan @utpal_parashar True :) Arunachal has similar terrain. May be the video is from China, but am sure the girls in Arunachal too must be doing similar things. May not be motorbike, but a bike, may not be bike, but a cart, whatever. Territory is not the theme, let's consider it as any hilly area",2
4215,Photos showing empty shelves at supermarkets,0
2248,@awelab1956 @afaduln2 @businessinsider It’s more than 100. People are dying and being left inside their homes. #coronarvirus https://t.co/QGCHw0ADYo,2
3556,"UK, USA have asked Indian Prime Minister Narendra Modi to lead a task force to tackle Coronavirus",0
6659,the 14 days quarantine be extended,0
5309,Clickbait / Russian scientists have a cure for fighting the new Chinese virus,0
3245,Police in India lashed sticks at filmmaker Sudhir Mishra for not following the rules of lockdown,0
6571,Attacked and exposed to the hospital’s “infected environment”,0
6525,facial mask is not effective against wuhan virus,0
3230,People in Italy are threw away their money after they lost their family members to coronavirus,0
2879,Food and vegetables markets closed in Chennai amid COVID-19 lockdown,0
215,Beer drinkers are shunning Corona as a result of the new coronavirus,0
3819,"According to Art. 116, a “state of emergency” will be implemented in Mexico that will limit the free movement of people to combat the #COVID-19 epidemic",0
392,Italy’s overwhelmed hospitals are treating elderly COVID-19 patients as a lower priority,2
27,"U.S. President Donald Trump referred to the new coronavirus as a ""hoax.""",2
1810,"Burning candles will produce heat and thus, raise the temperature and kill coronavirus",0
478,"Donald Trump tweeted, “Corona vaccine from Israel! Stock market up! Economy even stronger now! Besides US, Israel best at inventions: Judaism, olives. Wonderful vaccine, will stop Corona DEAD around world. Can’t make vaccines when being bombed, not have been possible without peace I created in Israel!”",0
5776,The scientist who helped China fight SARS in 2003 has been tapped to lead a national research team of 14 experts in the fight against Wuhan coronavirus,1
909,"Bethenny Frankel manufacturing, donating coronavirus kits and masks to thousands of health care workers",1
4913,The Dettol disinfectant label says the cov was tested,0
1558,"The Disaster Management Act (DMA) has been implemented across the country, according to which nobody except the government can update and post coronavirus related information on social media",0
5854,"[The medical team collapsed] [Wuhan Medical Care is asking for help! #coronavirus More than 10,000 medical staff at the main hospitals in Wuhan have been overwhelmed in the past few days and have not seen their loved ones, along with a shortage of supplies at the hospital",2
5808,billboard,2
2151,"the containment effort starts to seem to be effective,. Hopefully the outbreak can be entirely stopped soon, even the research on the vaccine may take 18 months,. https://t.co/fKA17jlaKp",2
6065,"Just In | #Pakistan has decided not to evacuate its citizens from the #coronavirus-hit Wuhan to show “solidarity” with its all-weather ally, a senior official announced, though four Pakistani nationals have contracted the deadly disease in China",2
2180,Fascinating #ShinyApp displaying the spread of coronavirus. Check it out! https://t.co/CbUjEAnjGq,1
5406,"Trump hails 'positive impact' of coronavirus: ""It's affecting the airline business...people are staying in our country and they're shopping and they're using our hotels...so from that same point I think...there's a positive impact,"" he saidhttps://americanindependent.com/donald-trump-coronavirus-positive-impact-white-house-covid-19/ …",1
563,Maria Bartiromo on jobless claims spiking to record-high as coronavirus shuts down economy,1
4753,An Australian couple ordered wine by drone on princess cruise ship,0
4805,A video claims to show a plane carrying medical supplies to China,0
4195,Ireland is going into a ‘Status Red’ lockdown with the military patrolling the streets,0
969,"The Southern California tennis tournament was expected to host upwards of 450,000 people, including 124,000 from outside the region. Many players already in Indian Wells practicing and preparing for the BNP Paribas Open were left scrambling when the postponement was announced",1
5296,"Coronavirus may have spread due to the consumption of bat soup, according to scientists",0
4942,Children under 8 are immune to the novel coronavirus,0
4176,Saddam Hussein explaining what is coronavirus about,0
5387,"Today, to all across the country and #CA12, make a plan to... White heavy check markVote for protecting people with pre-existing conditions and our health care. White heavy check markVote to save lives by reducing the gross epidemic of gun violence. White heavy check markVote to stop discrimination against the LGBTQ community",1
5810,"China vetoes Taiwan to participate in an emergency WHO meeting about the new coronavirus, which has killed at least 25 people since originating in the Chinese city of Wuhan last month. Taiwan has reported one case",2
4693,Radio host Rush Limbaugh compres novel coronavirus to ‘common cold’,0
3386,US Army Sells Food Just Like Egyptian Army,0
4102,The claim that there is a cure from the new coronavirus. The name of the drug is decametoxine,0
