id,sent0,label
4456,Every election year has a disease; coronavirus has a contagion factor of 2; coronavirus has a cure rate of 99.7% for those under 50 it infects,0
5921,Wuhan seafood market may not be source of novel virus spreading globally | Science | AAAS,2
3403,Actor Tom Hanks died due to coronavirus,0
646,International Lawyer David Tarfuri joins Trace Gallagher to discuss India's decision to lockdown for 21 days amid coronavirus pandemic,1
7175,"In Japan, if the new coronavirus test is negative, the cost is 80,000 yen. If positive, the state will bear the cost",0
2636,".@msnbc .@cnn Trump &amp; his admin been stating many folks will have low-level form of the coronavirus &amp; not know they have it. Which means, &amp; especially since there's no antidote for it, community transmission will be ON-GOING. If you develop a respiratory condition, you're screwed",2
5315,"WhatsApp text that says, among other things, that the Chinese created the virus and that the main cities in China did not suffer from the pandemic",0
5937,"2020 is the year of the Rat. A creature best known for carrying the plague, killing almost 200 million people during the medieval age. Now 2020 starts off with another plague-like virus, the Wuhan Coronavirus",2
6745,hospitals are overran stem from outside the hospital,0
2379,Philippine Government: Ban ALL flights from China due to coronavirus and Deport All Non Law Abiding Chinese - Sign the Petition! https://t.co/w6YZPWg5ux via @ChangePilipinas,2
6969,drinking alcohol or hot tea kills covid-19,0
4314,"Statement of Professor Jean-Jacques Muyembe, one of the experts who discovered Ebola, saying black skin is “so efficient that it can not be infected by novel coronavirus”",0
1986,Scientists Predict Wuhan's Virus Outbreak Will Get Much Worse | WIRE https://t.co/g9SIepdMQp,1
5047,Scientists claim Wuhan coronavirus is HIV-1 engineered “super weapon”,0
5554,Now is a great time for @JoeBiden to be bold and endorse a Universal Basic Income Stimulus while Trump remains incoherent in his response to the Coronavirus. #COVD19,1
6971,"COVID-19 is so dangerous because it is ""overwhelming our healthcare system!""",0
5256,Filipinos are eating a bat soup in Wuhan,0
668,"The former ""Bachelor"" star, 28, revealed he tested positive for COVID-19 in a post on social media. “I want to let you guys know: I’m 28, I consider myself pretty healthy, I work out regularly, I eat healthy, and I became symptomatic a few days ago, got my test results back today, and they are positive,” he said in an Instagram video on Friday, “It’s been kicking my ass, just to put it pretty bluntly,” Underwood added. “The main thing is I can’t even walk up a flight of stairs without being out of breath or go to the bathroom without having to sit down because I’m exhausted.”",1
1721,Drinking cow's urine can prevent you from getting the coronavirus,0
1475,At least 69 students at New York University's medical school may graduate three months early to help in the fight against the novel coronavirus,2
3872,Chinese intelligence officer terms the Novel coronavirus as a biological weapon invented by China,0
3855,"COVID-19 is no worse than other outbreaks that have occurred in “every election year,” suggesting that the new coronavirus is being “hyped” to hurt President Donald Trump",0
4739,World labs confirm: coronavirus was bioengineered,0
6735,homeland security is preparing to mobilize the national guard,0
2574,Shanghai Government Officially Recommends Vitamin C for #COVID-19 https://t.co/74vmR6srTj,2
2044,China’s Communist Party Uses All Sectors to Wage War on the US; The US M... https://t.co/K2qFfekm8J via @YouTube,2
4890,Cannibalism in China has caused the outbreak of a new strain of the novel coronavirus. A Chinese man is preparing a dead baby for consumption,0
4911,"China has sought to kill 20,000 coronavirus patients to control the spread of the virus",0
2689,"#OPINION: With no reliable screening and isolation during the incubation period, people arriving from #China pose a serious threat of spreading the infection among the general population, writes Dr. Mehreen Mujtaba || #Pakistan https://t.co/gXprk0Q2US",2
1813,"14 China Muslims hidden at Bihari mosque has been taken to corona virus test by Bihari police. Erode police has caught Thailand Muslim mullahs infected with corona virus. Today Salem Police has caught 11 Indonesian Muslim mullahs at Salem mosque. This video shows that they are applying and putting saliva on spoons, plates and utensils and also they are in the intention of spreading corona virus disease. Nobody knows what's happening in the Nation (sic)",0
1485,"""We ended up getting our first positive patients -- and that's when all hell broke loose,"" said one New York City doctor, describing a hospital that was woefully unprepared for an influx of Covid-19 patients that has already stretched resources thin",2
3303,"Tips from Professor Wong Kin-Chung to delay the progress of COVID-19 condition: rinsing mouth with cold salty water; drinking water and red wine; taking vitamin C; having chicken soup, shiitake mushroom, astragalus, codonopsis, and ginseng",0
2071,"Wuhan Corona Virus had spread everywhere in China, also reported in Asia, North America and Europe. Be very vigilant. Pakistan is not equipped to deal with this. https://t.co/jSJdz1jSxg",1
3365,Bahraini Women Escape From Quarantine,0
5950,"A new virus, originating from Wuhan in China, is quickly spreading across the country and around the world. This video highlights the key things you need to know about the outbreak and how science can help control it",2
3136,"An image of a doctor goes viral with the claim that Dr. Usman Riyaz died while treating coronavirus patients in Delhi, India",0
2351,"""It's Winter-Time For Capital Flow"" - Outbreak Sparks Collapse In Chinese Tech Venture Funding  https://t.co/IjFGVX7K9P https://t.co/zkj13Sm7bK",2
2790,"Interesting, especially the Corona Billionaires part... https://t.co/7AR9dykXbE",2
2118,"Wuhan, a city that never yields to hardships https://t.co/3VPVtPO0Ez 来自 @YouTube",1
3104,It is possible to self-diagnosis by holding breath for 10 second,0
3188,"Mostly You should take high doses of vitamin D against COVID-19; children don’t get sick because they lack the receptors for the virus to bond; the coronavirus is an unnatural mutation; it is not susceptible to temperatures, which is why infections will not sink in summer; the oldest patients will not be treated and left to die; 5G harms the immune system",0
522,Homeopathic supplements can rid you of flu symptoms after only three days,0
2108,"Three Countries Confirm 1st Case On Thursday, a 38-year-old Chinese female was tested positive for the novel coronavirus (2019-nCoV), the first case in the Philippines. #coronavirus",1
4921,Vitamin C stops or slows novel coronavirus,0
3936,Coronavirus will not be covered by private health insurance in Ecuador,0
4169,"The claim that a scientific paper published in Nature in 2015, shows that the new virus was developed in labs",0
7103,"Charlotte Gornitzka, who works for Unicef on coronavirus misinformation, says: ""A recent erroneous online message...purporting to be a Unicef communication appears to indicate that avoiding ice cream and other cold foods can help prevent the onset of the disease. This is, of course, wholly untrue.""",1
4135,There are one hundred children infected with COVID-19 in the main hospital in Lima,0
5092,"The coronavirus was called a “plague” by the WHO, and that 2.9 million were infected while 950,680 people had died",0
246,The coronavirus has been genetically engineered for the purposes of a weapon,0
6741,People Need A Photo ID To Be Tested For COVID-19 At A Community Based Testing Center (CBTS),1
5967,Wuhan flu and firestorms..$10 billion hit to economy by June? I’d say so..and a govt so utterly corrupted by ideological garbage that they have zero idea how to respond other than to say they are going to cull $2.5billion from welfare..Jesus wept..what a pack of morons.,2
2865,A Facebook post asserts the US developed a COVID-19 vaccine she plans to release this Sunday,2
5101,Says the coronavirus isn’t new because “Lysol has it listed as one of the viruses that it kills.”,0
4487,The media group Globo published a photo of the dead of the Lampedusa shipwreck as if it were victims of COVID-19,0
5190,A person died of hematemesis in Beitou. He was then diagnosed with 2019n-Cov. Wear a mask in Taipei,0
2851,Italian PM said that the country has surrendered to the Covid-19 pandemic,0
5045,Misinformation / Conspiracy The bottle of Dettol mentioned the coronavirus since October of 2019 and so the company knew that there was about to be an outbreak of the virus,0
4734,Chinese businessman Guo Wengui’s multiple allegations on coronavirus outbreak,0
5122,Gates Foundation funded development of coronavirus,0
6341,"A flight carrying passengers from Wuhan, China to San Francisco will not land at San Francisco International Airport amid concerns over the coronavirus, airport officials confirmed Monday",1
3397,Auto-hemotherapy cures COVID-19,0
4004,Drinking water and gargling with salt or vinegar eliminate the novel coronavirus,0
7000,Black people are socially distancing less than others and assuming that's why we are experiencing higher rates of COVID-19,0
6802,People who have Valley Fever are more susceptible,1
514,Hair extensions are a source of the 2019 coronavirus,0
1678,Muslims in Gujarat's Nadiad are attacking the police and shooting them in the backdrop of a lockdown to restrict the spread of the novel Coronavirus. Send the video to as many people as possible,0
1011,Delta Air Lines waives change fees for all tickets purchased in March and recently-booked travel through April,1
5885,"JUST IN: Health Sec. Francisco Duque confirms 3 Chinese nationals were admitted to San Lazaro Hospital in Manila after showing signs of flu; says 2 of them have travel history from China’s Wuhan City, the center of the novel coronavirus’ outbreak",2
4394,A person fainted in Cali’s bus terminal because of COVID-19,0
2088,#forex_humor Apple shuts down stores in China over mounting coronavirus fears https://t.co/N4gVmOwlHb https://t.co/NT0YrO7N7H,1
3374,Qatari Deputy Minister of Health leaves an Interview Because of coronavirus,0
406,"Donald Trump cut funding to the CDC, fired the Pandemic Response Team, refused WHO tests and wasted two weeks calling this outbreak a “Democrat hoax”",0
3909,The Australian Prime minister is about to announce a national lockdown,0
2080,"All the respect to the doctors, nurses and all the medical staff fighting to save the victims of the #coronavirus they are in the middle of a war. Hope they stay safe and can go back to their family peacefully 😔♥️♥️#notallheroeswearaCape praying for you ✊ https://t.co/6FA8scSpIt",1
1878,Be a righteous Chinese. Take your mask away. The #peoplesdaily advice back in Aug19. #WuhanCoronavirus https://t.co/P4KqMCCSJW,1
2846,Air forces in Sri Lanka and the Philippines are spraying COVID-19 disinfectant from military helicopters,0
5007,Twitter user posts viral image suggesting that cocaine kills coronavirus,0
1184,Influencers Tell TikTok to Stop Purging Their Videos,2
3255,A post with photos claiming that COVID-19 infected patients in Italy are left in the street,0
4428,Medical Center in El Cachorro (Sevilla) closed due to possible coronavirus infected person,0
5453,"""The [coronavirus] tests are all perfect. Like the letter was perfect. The transcription was perfect. This was not a perfect as that, but pretty good."" -- is Trump referring to the transcript of his phone call with the Ukrainian president here",1
630,Texas included abortion among unnecessary medical procedures it ordered stopped to conserve medical resources during the coronavirus pandemic,1
4085,Cristiano Ronaldo decided to turn his hotels into free hospital,0
6408,"Anyone know if chocolate is good for colds? CDC lists chocolate above rest, vitamin C , and Hallmark movies",0
3895,Claim that an American soldier was intentionally spreading the novel coronavirus in Wuhan during the seventh CISM Military World Games in October 2019 with a video clip of a man purportedly smearing saliva on the handrail on a train,0
633,NY emergency doctor says patients' COVID-19 symptoms are slowly growing more severe,1
3628,"Video shows Italian people do a islamic prayer in streets, asking God to alleviate COVID19 epidemic",0
4784,"Upon approval from Supreme People’s Court, China will kill 20,000 patients with novel coronavirus",0
921,Men's world hockey championships in Switzerland canceled,1
3711,"Thanks to the halt imposed by the government to travel boats for Covid-19, a crocodile has shown up in Venice’s canals",0
5807,Bizarre. In original 1981 edition it was a Russian bioweapon named Gorki-400. After the cold war ended it was changed to Wuhan-400 for The 1996 edition. A virus called Wuhan-400 causes outbreak … in a Dean Koontz thriller from 1981. https://www.scmp.com/lifestyle/arts-culture/article/3050481/virus-called-wuhan-400-makes-people-terribly-ill-dean-koontz … lähteestä,2
3542,Video shows EU flag was lowered in France to protests outbreak policies,0
1304,China accuses U.S. of scaremongerng over coronavirus,2
7081,"[FALSE] Videos of ""Italian suicide who lost entire family to Corona"" The context of sharing date compared to the occurence original publication date is UNRELATED to Italy's COVID-19 condition",1
4110,Footballer Ronaldo is turning his hotels into Covid-19 hospitals,0
4348,Says you can monitor yourself for COVID-19 with a breath test,0
1765,Coronavirus survives only for 12 hours,0
4865,A case of coronavirus in Andorra,0
3507,"MOSTLY Says for otherwise healthy people “experiencing mild to moderate respiratory symptoms with or without a COVID-19 diagnosis … only high temperatures kill a virus, so let your fever run high,” but not over 103 or 104 degrees",0
913,Danish market creatively prices hand sanitizer to discourage coronavirus hoarding,1
720,olsonaro calls Brazilian cities' coronavirus lockdowns a 'crime',1
122,Disneyland closes as California rushes to battle coronavirus,1
7032,An evangelical preacher who claims he can cure the virus,0
1853,"Two staff from Lewisham hospital, south London, are now in isolation after coming into contact with the coronavirus patient, a Chinese national who recently arrived from China. https://t.co/lmZ0cTsUnY",1
5824,"Health authorities in China said 15 more people have died from the coronavirus outbreak in Wuhan, bringing the death toll to 41",2
3410,Mostly Dolphins and swans return to Italy waterways after COVID-19 lockdown,0
545,The Chinese Communist Party will finally admit that the real source of the coronavirus is from a lab in Wuhan linked to its covert biological weapon programs,0
6205,"A coronavirus R0 (R naught) > 2 value would suggest aerosol transmission. The Chinese state media Xinhua report of hand to mouth transmission is likely disinformation from the Wuhan Institute of Virology, the possible true errant source of the virus",2
6440,Everyone please take care. This Wuhan virus really spreading like wildfire,0
1673,Xi Jinping Visits Muslim Homes To Learn How To Fight Coronavirus,0
6670,"1,000 cases of espionage, with Chinese spies infiltrating the State Department, CIA and DIA",0
2311,Korea has been doing such a great job! I’m just a lil bit worried what happens when we reach the tipping point and the health system gets overwhelmed https://t.co/OyojzyfI4V,1
4413,"Graphics or social media cards supposedly from the international body United Nations Children’s Fund (Unicef) contain tips and information on how to prevent and combat the coronavirus outbreak and the disease it causes, COVID-19",0
2836,"This is a main stream media trend: declare something as a conspiracy theory and then weeks later, without explanation, start reporting it as fact https://t.co/gq3BLeRnv9",2
1047,Terrence McNally: Playwright dies of coronavirus complications,1
1902,238 Indonesians from China arrive in Natuna Island to be quarantined for the next 14 days https://t.co/Ogcfg2j0u2,1
4125,Coronavirus found in crab legs,0
3904,"false and A sensationalist headline, mislieading readers: “Disturbing video: A proof that only today there are 349 dead in Italy, stay at home.”",0
890,McDonald's changes Golden Arches logo amid coronavirus outbreak to demonstrate social distancing,1
6991,Extremely hot or cold climates curb the spread,0
1709,"Ok, Patriots so I’m watching the movie UNLOCKED on Showtime and this scene pops up of coffins lined up and guess where I saw that exact picture… from our MSM telling us that this is ITALY right now because of COVID 19 virus!",0
3184,Srilanka’s KDU hospital to be dedicated to treat only VIP COVID19 patients,0
5264,The Chinese Communist Party “will finally admit that the real source of the coronavirus is from ‘a lab in Wuhan’ linked to its covert biological weapon programs.”,0
2895,"""COVID-19 is confirmed as airborne and remain 8 hrs in air! So everyone is required to wear mask everywhere!""",0
4808,A video shows a family killed by the coronavirus amid China’s multi-city lockdown,0
1708,The “MSM” — mainstream media — is using an image from a 2017 movie in its coverage of the novel coronavirus pandemic,0
3239,A chart comparing those infected and killed by the coronavirus in Argentina and Spain,0
5686,"Caixin removed its paywall for all #WuhanCoronavirus related articles in Chinese, publishing a series of reports on the ground from Wuhan and Guangzhou, WHO conference in Geneva, expert interviews in Hong Kong and Washington DC. It has done a huge service to the public",1
471,The coronavirus was invented and patented in the USA and then planted in China,0
4550,Alcohol kills coronavirus,0
6163,Thailand found good results after using a mix of two antiviral drugs on a Chinese patient who was in a serious condition with the novel coronavirus,2
1349,Hongkonger in Hubei feeling ‘helpless’ after told family must ‘stay put’ during lockdown of province,2
4388,PARTLY A second version of the coronavirus is spreading and it is far more dangerous,0
984,Brazoria County has issued a Stay Safe at Home order in effect until April 3,1
6625,"1. #2019nCoV: The number of confirmed cases in China crossed the 40,000 mark on Feb. 9, increasing 3062 cases to 40,171. Every 3 days at this point, another 10,000 confirmed cases are being added. Feb. 3 - 20K Feb. 6 - 30K Feb. 9 - 40K",0
5321,The Wuhan Government is constructing a specialised hospital to handle all the Corona Virus patients in 6 days....the Chinese are going to construct a whole hospital in 6days,1
1276,China says Wuhan coronavirus victims who die should be quickly cremated without funerals as death toll rises,2
6286,More than 440 cases of coronavirus are now confirmed in China and the death toll from the outbreak has risen to 9 people,1
5297,"A Chinese person, who was taken from Kansai airport (in Osaka, Japan) to a hospital, has run away before they could be tested",0
3514,"“We were slow with the testing, but very quick with the travel ban. And that’s been much more critical in saving lives.”",0
775,"Utah Jazz small forward Joe Ingles said he would retire from the NBA without hesitation if it meant keeping his son, who suffers from autism, safe from the threat of the coronavirus",1
1480,"The commissioner of the US Food and Drug Administration, Dr. Stephen Hahn, is warning against self-medicating with any form of chloroquine phosphate unless prescribed by a doctor",2
4339,The Italian department of civil protection has communicated that since the 16h of March there is the possibilty that will be introduce the bio-containment BSL-4,0
5105,People who have ACE2 easily to be infected with 2019-nCov. Especially people who have hypertension,0
3086,Hydroxychloroquine and Azithromycin are a cure for Covid-19,2
3350,Prince of Qatar Infected With coronavirus,0
3565,Queen Elizabeth II is infected with the new coronavirus,0
2204,Wilbur Ross says Coronavirus could boost US jobs https://t.co/0zJZZcXKeI https://t.co/rFyJVI4i1Q,2
4286,Coronavirus found in toilet paper,0
4074,"There are 30 cases of COVID-19 in Barranquilla, but the government is hiding them",0
569,"An Alabama resident who tested positive for the novel coronavirus, COVID-19, has died, according to the state’s health department",1
3744,italian mimcks muslim prayers because of fear from COVID19,0
1509,More half of New Orleans' medical emergency services personnel is under quarantine due to the coronavirus pandemic,2
22,"A video shows a chaotic scene in Wuhan, China, involving doctors armed with weapons, gunshots to deter people from leaving a new coronavirus quarantine, and a woman who was shot dead after she attempted to break through a roadblock",0
3852,People with A-blood type are more prone to get coronavirus,0
2849,"Covid-19 positive cases in Nagapur reach 59, a team from Sweden coming to Nagpur to conduct tests",0
5841,confirmed a fourth imported case of the #Wuhan #coronavirus early on Sunday,2
4166,Viral post suggests Dettol sanitizer can kill coronavirus,0
5701,We vaccinated our first born son we didn’t know any better we followed the cdc schedule he’s now autistic. My daughter is unvaccinated and is healthy she’s never had a fever no ear aches. She eats natural foods no processed bullshit. Wish we would have researched more,1
3750,Photo showing crowd during illegal – due to quarantine -Way of the Cross prayers in Wejherowo,0
1491,"Nevada’s governor has signed an emergency regulation limiting the use of two anti-malaria drugs to treat coronavirus patients, the same medication that President Trump has touted as possible treatments",2
3597,The french doctor Jean-Roger Hospital sent an e-mail which claim that you can protect yourself against COVID-19 by drinking water very 15 minutes,0
5555,"I understand the Chinese government hates the label ""Wuhan Virus,"" so that's all I'm going to call it from now on",1
1658,"You are sitting here and making jokes on coronavirus but if you want to see the true devastation caused by corona, watch this video from China. Not once, not twice, watch attentively at least thrice. Watch these people who are stuck in this epidemic. The police administration there have to face so many difficulties to catch them. Your heart will stop after you watch this",0
5799,"If live foxes, crocodiles, wolf puppies, giant salamanders, snakes, rats, peacocks, porcupines, camel meat and other game weren’t on the menu @ Wuhan market, they needn’t bother",1
856,Pittsburgh Pirates players buy 400 pizzas for hospital staff on coronavirus front lines. The Pittsburgh Pirates were the next team to step up to the plate during the coronavirus pandemic,1
3515,There are plenty of mortuary bags in Lenox Hills Hospital in NY,0
6519,Purify yourself with a oregano oil,0
4035,“A looting” in a supermarket due to the coronavirus,0
6754,Russian media are weaponizing the narrative the EU abandoned its members during #coronavirus #COVID19 outbreak,0
7163,"Mostly Video of a waitress saying, “I lost my job. But I’ll sleep better knowing” that the coronavirus relief bill included funding for the Kennedy Center, refugee resettlement, PBS, and congressional salaries: “Thanks, Democrats”",0
2300,"Shahzaib Rahujo, who studies at a university in China, around 1,000 kilometres away from Wuhan, reached his village late Saturday night. https://t.co/9yHTazFOVx",1
3315,The Chinese President Visits A Mosque To Ask Muslims’ Prayers To Fight coronavirus,0
4003,"You can self-diagnose COVID-19 by holding your breath for ten seconds, avoid COVID-19 by drinking water constantly. Also, COVID-19 causes fibrosis in the lungs",0
4233,"A worker of Prince hotel in Mehdipatnam (Hyderbad, India) has tested positive for coronavirus",0
581,Sports leagues across the globe have suspended their seasons in response to the COVID-19 outbreak,1
2490,Coronavirus Infection Found After More Than 1000 Cruise Ship Passengers Disperse https://t.co/8wq5fh8gS5,1
6568,CCP China bans all travel for New Year Festival to better protect citizens,0
2848,Photo shows army trucks in Italy carrying bodies of fatalities from coronavirus disease or COVID-19,0
2215,"@yaneerbaryam I'll believe it when I see it. I think this is better explained by Chinese health system being maxed out and because so many people are self quarantining across China, that's going to be very hard to maintain and with an incubation period so long it won't die out and surge again",2
4076,Gargles with hot water and salt can prevent COVID-19,0
844,Korean Basketball League cancels season due to coronavirus concerns: report,1
6580,The people don't want to remove the bull and the China shop they just want a new manager for fuck sakes Mitchell,0
3598,"When you complete a registration for a 5000 Baht support fund, it will show you a green sign, not a blue sign",0
6954,the #COVID19 virus was designed in a lab to disproportionately kill POC,0
6946,Covid-19 | 21/03/2020 9:30 We're aware of inaccurate and dangerous advice circulating on Covid-19 Posts claiming to be doctors suggesting you can self-check for coronavirus by holding your breath are not accurate. For medical advice always visit NHS111,1
468,Florida hospital reports a coronavirus ‘infestation’ with multiple confirmed patients,0
1444,"The number of coronavirus cases in California is doubling every three to four days, the state's top health official has said",2
3523,The viral post claims that Aajtak news channel shows lockdown is withdrawn at few places while India Today news channel shows it is extended till May 4,0
3634,Prince Charles tested positive for COVID-19 after meeting Bollywood singer Kanika Kapoor,0
2936,"A video shows overcrowding in St Mary’s Hospital, London and Covid-19 patients lying on the floor in corridors",0
